objectid,filename,title,description,format
coll002,SUM_aaa_squarestills.jpg,Summed Z-Projection of An Autumn Afternoon (1962),Summed Z-Projection,image/jpeg
coll003,SUM_ef_squarestills.jpg,Summed Z-Projection of Equinox Flower (1958),Summed Z-Projection,image/jpeg
coll004,SUM_eos_squarestills.jpg,Summed Z-Projection of End of Summer (1961),Summed Z-Projection,image/jpeg
coll005,SUM_la_squarestills.jpg,Summed Z-Projection of Late Autumn (1960),Summed Z-Projection,image/jpeg
coll006,aaa_square0090.jpg,An Autumn Afternoon (1962) still with square pixels,Video still,image/jpeg
coll007,aaa_0090.jpg,An Autumn Afternoon (1962) still without square pixels,Video still,image/jpeg